{
  "schema_version": 1,
  "provider_id": "taigi_cert",
  "evidence_url": "https://ttg.moe.edu.tw/tmt/view.php?page=resource",
  "rules_url": "https://ttg.moe.edu.tw/tmt/view.php?page=questionBase",
  "resources": [
    {
      "id": "taigi-native-f2b7d6a7f013e9e1bdcc-996de12758ae7a0a3d09",
      "form_code": "a",
      "skill": "聽力",
      "source_url": "https://ttg.moe.edu.tw/tmt/src/upload/file/file_2.pdf",
      "source_label": "A卷聽力測驗範例題本",
      "checksum": "996de12758ae7a0a3d09105b399faadcec284ba4878b01d06af2f9cf8f73d403",
      "file_type": "question",
      "payload_format": "pdf",
      "native_heading": "教育部臺灣台語語言能力認證 A卷 聽力測驗",
      "published_on": "2017-03-24",
      "revised_on": "2023-02-22",
      "page_count": 7,
      "review_basis": "native_question_instructions",
      "archive_members": [],
      "reviewed_at": "2026-10-21",
      "notes": "Official downloadable examples, not administered papers. Preserve the explicitly printed initial publication date separately from the printed modification date; neither is an exam year. Missing dates are not inferred from companion files, MP3 tags, ZIP timestamps or the capture partition. Source-role review does not imply independent verification of every model answer or a full semantic listen-through.",
      "current": true
    },
    {
      "id": "taigi-native-5db0ae19ee7b614a384a-bc6914d612a98e1d7b5a",
      "form_code": "a",
      "skill": "聽力",
      "source_url": "https://ttg.moe.edu.tw/tmt/src/upload/file/file_4.mp3",
      "source_label": "A卷聽力測驗範例音檔",
      "checksum": "bc6914d612a98e1d7b5ab18556be0767e26c04488a237b6cb43e3d35129cfbda",
      "file_type": "listening_audio",
      "payload_format": "mp3",
      "native_heading": "",
      "published_on": null,
      "revised_on": null,
      "page_count": null,
      "review_basis": "official_skill_audio_and_full_MP3_decode",
      "archive_members": [],
      "reviewed_at": "2026-10-21",
      "notes": "Official downloadable examples, not administered papers. Preserve the explicitly printed initial publication date separately from the printed modification date; neither is an exam year. Missing dates are not inferred from companion files, MP3 tags, ZIP timestamps or the capture partition. Source-role review does not imply independent verification of every model answer or a full semantic listen-through.",
      "current": true
    },
    {
      "id": "taigi-native-2fb4fdfbb993d03faa4f-c2238e2f61ae9a421e93",
      "form_code": "a",
      "skill": "聽力",
      "source_url": "https://ttg.moe.edu.tw/tmt/src/upload/file/file_39.pdf",
      "source_label": "A卷聽力測驗範例參考答案",
      "checksum": "c2238e2f61ae9a421e937a9d420be588353c6b1767dadfe3e8ed63dbf00811e4",
      "file_type": "answer",
      "payload_format": "pdf",
      "native_heading": "教育部臺灣台語語言能力認證 A卷 聽力測驗",
      "published_on": null,
      "revised_on": null,
      "page_count": 1,
      "review_basis": "native_answer_table",
      "archive_members": [],
      "reviewed_at": "2026-10-21",
      "notes": "Official downloadable examples, not administered papers. Preserve the explicitly printed initial publication date separately from the printed modification date; neither is an exam year. Missing dates are not inferred from companion files, MP3 tags, ZIP timestamps or the capture partition. Source-role review does not imply independent verification of every model answer or a full semantic listen-through.",
      "current": true
    },
    {
      "id": "taigi-native-49e762dfd656c5b95fdb-7518e068d4bbd9f8c524",
      "form_code": "a",
      "skill": "口語",
      "source_url": "https://ttg.moe.edu.tw/tmt/src/upload/file/file_30.pdf",
      "source_label": "A卷口語測驗範例題本",
      "checksum": "7518e068d4bbd9f8c524c16ff856ab876ac6184485f1a2505edbf792ca66c737",
      "file_type": "question",
      "payload_format": "pdf",
      "native_heading": "教育部臺灣台語語言能力認證 A卷 口語測驗",
      "published_on": "2017-03-24",
      "revised_on": "2023-02-22",
      "page_count": 5,
      "review_basis": "native_question_instructions",
      "archive_members": [],
      "reviewed_at": "2026-10-21",
      "notes": "Official downloadable examples, not administered papers. Preserve the explicitly printed initial publication date separately from the printed modification date; neither is an exam year. Missing dates are not inferred from companion files, MP3 tags, ZIP timestamps or the capture partition. Source-role review does not imply independent verification of every model answer or a full semantic listen-through.",
      "current": true
    },
    {
      "id": "taigi-native-67bc22a494e45ae1eedb-d34d81270f04acba5ae9",
      "form_code": "a",
      "skill": "口語",
      "source_url": "https://ttg.moe.edu.tw/tmt/src/upload/file/file_101.mp3",
      "source_label": "A卷口語測驗範例音檔",
      "checksum": "d34d81270f04acba5ae9858fb24ada4f7358d8f37daaf0e122decd7d167a627b",
      "file_type": "speaking_audio",
      "payload_format": "mp3",
      "native_heading": "",
      "published_on": null,
      "revised_on": null,
      "page_count": null,
      "review_basis": "official_skill_audio_and_full_MP3_decode",
      "archive_members": [],
      "reviewed_at": "2026-10-21",
      "notes": "Official downloadable examples, not administered papers. Preserve the explicitly printed initial publication date separately from the printed modification date; neither is an exam year. Missing dates are not inferred from companion files, MP3 tags, ZIP timestamps or the capture partition. Source-role review does not imply independent verification of every model answer or a full semantic listen-through.",
      "current": true
    },
    {
      "id": "taigi-native-69be710c8e8f465942ee-63f8966c99b57e4c5813",
      "form_code": "a",
      "skill": "口語",
      "source_url": "https://ttg.moe.edu.tw/tmt/src/upload/file/file_42.pdf",
      "source_label": "A卷口語測驗範例參考答案",
      "checksum": "63f8966c99b57e4c581358b17bedd215c758b6122ffe6e822bdc3ef40de88e4a",
      "file_type": "answer",
      "payload_format": "pdf",
      "native_heading": "教育部臺灣台語語言能力認證 A卷 口語測驗",
      "published_on": "2017-03-24",
      "revised_on": "2023-02-22",
      "page_count": 5,
      "review_basis": "native_model_answers",
      "archive_members": [],
      "reviewed_at": "2026-10-21",
      "notes": "Official downloadable examples, not administered papers. Preserve the explicitly printed initial publication date separately from the printed modification date; neither is an exam year. Missing dates are not inferred from companion files, MP3 tags, ZIP timestamps or the capture partition. Source-role review does not imply independent verification of every model answer or a full semantic listen-through.",
      "current": true
    },
    {
      "id": "taigi-native-0931291b7d55bc180d2c-fd6a7cdf44da2ac7707e",
      "form_code": "a",
      "skill": "閱讀",
      "source_url": "https://ttg.moe.edu.tw/tmt/src/upload/file/file_32.pdf",
      "source_label": "A卷閱讀測驗範例題本",
      "checksum": "fd6a7cdf44da2ac7707e986fca88ee9afda0e2fcc7de7eda7ce1ee1fab12df0e",
      "file_type": "question",
      "payload_format": "pdf",
      "native_heading": "教育部臺灣台語語言能力認證 A卷 閱讀測驗",
      "published_on": "2017-03-24",
      "revised_on": "2023-02-22",
      "page_count": 5,
      "review_basis": "native_question_instructions",
      "archive_members": [],
      "reviewed_at": "2026-10-21",
      "notes": "Official downloadable examples, not administered papers. Preserve the explicitly printed initial publication date separately from the printed modification date; neither is an exam year. Missing dates are not inferred from companion files, MP3 tags, ZIP timestamps or the capture partition. Source-role review does not imply independent verification of every model answer or a full semantic listen-through.",
      "current": true
    },
    {
      "id": "taigi-native-9c7def7b00aa56ae2e04-01b876f9bd46de62e545",
      "form_code": "a",
      "skill": "閱讀",
      "source_url": "https://ttg.moe.edu.tw/tmt/src/upload/file/file_45.pdf",
      "source_label": "A卷閱讀測驗範例參考答案",
      "checksum": "01b876f9bd46de62e5450031730554222985ac47de4909a17fcac2d3fa405fef",
      "file_type": "answer",
      "payload_format": "pdf",
      "native_heading": "教育部臺灣台語語言能力認證 A卷 閱讀測驗",
      "published_on": "2017-03-24",
      "revised_on": "2017-03-29",
      "page_count": 1,
      "review_basis": "native_answer_table",
      "archive_members": [],
      "reviewed_at": "2026-10-21",
      "notes": "Official downloadable examples, not administered papers. Preserve the explicitly printed initial publication date separately from the printed modification date; neither is an exam year. Missing dates are not inferred from companion files, MP3 tags, ZIP timestamps or the capture partition. Source-role review does not imply independent verification of every model answer or a full semantic listen-through.",
      "current": true
    },
    {
      "id": "taigi-native-c1c2686040e8763ef606-7a003ea41f0e0c8beb4e",
      "form_code": "a",
      "skill": "書寫",
      "source_url": "https://ttg.moe.edu.tw/tmt/src/upload/file/file_35.pdf",
      "source_label": "A卷書寫測驗範例題本",
      "checksum": "7a003ea41f0e0c8beb4e7e28d9d483c79f40ab752b5bf25a346fc28220ee9cfe",
      "file_type": "question",
      "payload_format": "pdf",
      "native_heading": "教育部臺灣台語語言能力認證 A卷 書寫測驗",
      "published_on": "2017-03-24",
      "revised_on": "2023-02-22",
      "page_count": 4,
      "review_basis": "native_question_instructions",
      "archive_members": [],
      "reviewed_at": "2026-10-21",
      "notes": "Official downloadable examples, not administered papers. Preserve the explicitly printed initial publication date separately from the printed modification date; neither is an exam year. Missing dates are not inferred from companion files, MP3 tags, ZIP timestamps or the capture partition. Source-role review does not imply independent verification of every model answer or a full semantic listen-through.",
      "current": true